{
 "world": "zombie",
 "version": 1,
 "built": "2026-10-21",
 "npcs": [
  {
   "id": "trần khải",
   "name": "Trần Khải",
   "aliases": [
    "Chen Kai",
    "thiếu tá Trần",
    "Major Trần Khải"
   ],
   "importance": 100,
   "traits": {
    "open": 60,
    "consc": 78,
    "extra": 35,
    "agree": 45,
    "neuro": 40
   },
   "speech": "terse",
   "wants_to_say": "He commands the defence of Dalian's port and buys fuel from Xiao Beifeng; he feels where a defensive line will break.",
   "wants_to_hide": "He holds the Line System and hides it from Tô Cảnh's institute, which wants all unturned.",
   "hide_fid": 1088,
   "tags": [
    "protective",
    "proud",
    "honest"
   ],
   "source": "Trần Khải; Line System"
  },
  {
   "id": "taro whitman",
   "name": "Taro Whitman",
   "aliases": [
    "Whitman",
    "Taro",
    "người đưa hàng"
   ],
   "importance": 91,
   "traits": {
    "open": 62,
    "consc": 60,
    "extra": 66,
    "agree": 62,
    "neuro": 45
   },
   "speech": "playful",
   "wants_to_say": "He knows Kisaragi Nam to Khu Đông better than anyone and will sell a safe route or teach scavenging through it.",
   "wants_to_hide": null,
   "hide_fid": null,
   "tags": [
    "honest",
    "kind"
   ],
   "source": "Route System"
  },
  {
   "id": "tetsuo price",
   "name": "Tetsuo Price",
   "aliases": [
    "Price",
    "ông Price",
    "the Nagoya ham operator"
   ],
   "importance": 87,
   "traits": {
    "open": 55,
    "consc": 72,
    "extra": 40,
    "agree": 66,
    "neuro": 48
   },
   "speech": "formal",
   "wants_to_say": "He broadcasts nightly at 22:00 on the ham bands from Nagoya and relays Yoon Ha-eun's Korean broadcasts at 20:00.",
   "wants_to_hide": "He is surrounded and starving in his tower but tells no one, eating once a day.",
   "hide_fid": 1084,
   "tags": [
    "honest",
    "protective",
    "proud"
   ],
   "source": "Tetsuo Price, the Nagoya ham operator"
  },
  {
   "id": "the observer",
   "name": "the Observer",
   "aliases": [
    "Ren Halloway",
    "Observer",
    "Kẻ Quan Sát",
    "Halloway"
   ],
   "importance": 83,
   "traits": {
    "open": 88,
    "consc": 70,
    "extra": 40,
    "agree": 12,
    "neuro": 22
   },
   "speech": "mocking",
   "wants_to_say": "He wants the Mother for himself.",
   "wants_to_hide": null,
   "hide_fid": null,
   "tags": [
    "ruthless",
    "cynical",
    "proud"
   ],
   "source": "The Observer"
  },
  {
   "id": "daisuke morgan",
   "name": "Captain Daisuke Morgan",
   "aliases": [
    "Daisuke Morgan",
    "Morgan",
    "đại úy Morgan"
   ],
   "importance": 74,
   "traits": {
    "open": 48,
    "consc": 74,
    "extra": 42,
    "agree": 60,
    "neuro": 52
   },
   "speech": "terse",
   "wants_to_say": "His company holds the bridges, and his wife and two children are in a refugee block in the Green Zone's park.",
   "wants_to_hide": "He is secretly a hidden unturned with a Command System, hiding it from Lab K and from Langley.",
   "hide_fid": 1233,
   "tags": [
    "loyal",
    "protective",
    "honest"
   ],
   "source": "The Cordon"
  },
  {
   "id": "reina carter",
   "name": "Reina Carter",
   "aliases": [
    "Reina",
    "Null",
    "trung sĩ Carter"
   ],
   "importance": 70,
   "traits": {
    "open": 45,
    "consc": 65,
    "extra": 30,
    "agree": 55,
    "neuro": 50
   },
   "speech": "blunt",
   "wants_to_say": "She grew up in her father's garage in Kisaragi Cũ; she watches from the rear on a roof and her rifle can pop a Bloat from afar.",
   "wants_to_hide": "After a bite she gained Null, a zone of biological silence, and hides it from her squad and Captain Morgan.",
   "hide_fid": 668,
   "tags": [
    "loyal",
    "protective"
   ],
   "source": "Reina Carter"
  },
  {
   "id": "mari ford",
   "name": "Lieutenant Mari Ford",
   "aliases": [
    "Ford",
    "Mari Ford",
    "trung úy Ford"
   ],
   "importance": 66,
   "traits": {
    "open": 60,
    "consc": 70,
    "extra": 55,
    "agree": 62,
    "neuro": 42
   },
   "speech": "formal",
   "wants_to_say": "She wants her mother's family in Itoman on a flight to Hawaii, and she speaks for the bases to the prefecture.",
   "wants_to_hide": null,
   "hide_fid": null,
   "tags": [
    "loyal",
    "kind",
    "honest"
   ],
   "source": "USFK liaison"
  },
  {
   "id": "dr. takeshi morrow",
   "name": "Dr. Takeshi Morrow",
   "aliases": [
    "Morrow",
    "Dr. Morrow",
    "nhà virus học"
   ],
   "importance": 61,
   "traits": {
    "open": 85,
    "consc": 72,
    "extra": 25,
    "agree": 38,
    "neuro": 35
   },
   "speech": "cold",
   "wants_to_say": "He pays or asks for sealed tissue samples (Bloater fluid, Lurker throat, Node ridge) and will tell Test Subject 7's weakness only if pressed.",
   "wants_to_hide": "He treats the infection of the Hacker System's holder as a dataset he may slow or steer.",
   "hide_fid": 1909,
   "tags": [
    "ambitious",
    "cynical",
    "ruthless"
   ],
   "source": "Lab K; White Cross"
  },
  {
   "id": "haruto quinn",
   "name": "Haruto Quinn",
   "aliases": [
    "Haruto",
    "WATCHMAN-7",
    "Yoshiro Pembroke",
    "K-2"
   ],
   "importance": 53,
   "traits": {
    "open": 52,
    "consc": 68,
    "extra": 36,
    "agree": 58,
    "neuro": 45
   },
   "speech": "warm",
   "wants_to_say": "He wants the character to live and to stop reporting to Lighthouse.",
   "wants_to_hide": "He is WATCHMAN-7 of Lighthouse and keeps a case holding a sealed sample of the strain in his flat.",
   "hide_fid": 952,
   "tags": [
    "protective",
    "loyal",
    "kind"
   ],
   "source": "Lighthouse; Chung cư Kisaragi"
  },
  {
   "id": "sakura",
   "name": "Sakura",
   "aliases": [
    "Sakura Ellis",
    "Ellis",
    "vận động viên"
   ],
   "importance": 48,
   "traits": {
    "open": 55,
    "consc": 70,
    "extra": 50,
    "agree": 58,
    "neuro": 45
   },
   "speech": "blunt",
   "wants_to_say": "She wants her younger brother Ken alive in Nagoya and to be useful to someone who does not waste her.",
   "wants_to_hide": null,
   "hide_fid": null,
   "tags": [
    "loyal",
    "protective",
    "proud"
   ],
   "source": "Sakura Ellis"
  },
  {
   "id": "mio ashford",
   "name": "Mio Ashford",
   "aliases": [
    "Dr. Mio Ashford",
    "Mio",
    "Dr. Ashford",
    "bác sĩ Mio"
   ],
   "importance": 44,
   "traits": {
    "open": 62,
    "consc": 70,
    "extra": 38,
    "agree": 60,
    "neuro": 62
   },
   "speech": "blunt",
   "wants_to_say": "With Dr. Morrow's data she wants a real treatment for the infection, and she wants the Night Nurse gone for the pharmacy stock and basement stair.",
   "wants_to_hide": "She has Stasis, which slows infection at the cost of blue hands for an hour.",
   "hide_fid": 651,
   "tags": [
    "protective",
    "kind",
    "proud"
   ],
   "source": "White Cross; Lab K"
  },
  {
   "id": "hana whitlock",
   "name": "Hana Whitlock",
   "aliases": [
    "Hana",
    "Cầu Chì",
    "cô kỹ sư"
   ],
   "importance": 35,
   "traits": {
    "open": 78,
    "consc": 66,
    "extra": 28,
    "agree": 55,
    "neuro": 62
   },
   "speech": "timid",
   "wants_to_say": "She wants a project bigger than a single drone and praise from someone who knows good work.",
   "wants_to_hide": "She knows Kazuo was bitten on a vending-machine run and hides it.",
   "hide_fid": 769,
   "tags": [
    "loyal",
    "protective"
   ],
   "source": "Hana Whitlock"
  },
  {
   "id": "kaede rowe",
   "name": "Kaede Rowe",
   "aliases": [
    "Rowe",
    "Kaede",
    "thợ săn K"
   ],
   "importance": 31,
   "traits": {
    "open": 48,
    "consc": 72,
    "extra": 40,
    "agree": 28,
    "neuro": 40
   },
   "speech": "cold",
   "wants_to_say": "She leads hunters who capture unturned for the Cordon's bounty; her younger sister Nanako is in the Green Zone's refugee camp.",
   "wants_to_hide": null,
   "hide_fid": null,
   "tags": [
    "ruthless",
    "protective",
    "loyal"
   ],
   "source": "The K-hunters; Cordon"
  },
  {
   "id": "reed maynard",
   "name": "Reed",
   "aliases": [
    "Reed Maynard",
    "Utako Reed",
    "Corporal Reed"
   ],
   "importance": 27,
   "traits": {
    "open": 45,
    "consc": 60,
    "extra": 45,
    "agree": 50,
    "neuro": 48
   },
   "speech": "blunt",
   "wants_to_say": "He carries cable ties for Kaede's hunts and is a hired hand of the K-hunters.",
   "wants_to_hide": null,
   "hide_fid": null,
   "tags": [
    "loyal",
    "greedy"
   ],
   "source": "K-hunters"
  },
  {
   "id": "kang seo-yeon",
   "name": "Kang Seo-yeon",
   "aliases": [
    "Seo-yeon",
    "Triage"
   ],
   "importance": 23,
   "traits": {
    "open": 55,
    "consc": 80,
    "extra": 35,
    "agree": 58,
    "neuro": 48
   },
   "speech": "terse",
   "wants_to_say": "She works the triage tent at Busan port at dawn and dusk and can read on sight who among the bitten will turn.",
   "wants_to_hide": "She is secretly an unturned hiding inside the system.",
   "hide_fid": 1368,
   "tags": [
    "protective",
    "honest"
   ],
   "source": "Triage System"
  },
  {
   "id": "ryota banks",
   "name": "Sergeant Ryota Banks",
   "aliases": [
    "Ryota Banks",
    "Banks",
    "trung sĩ Banks"
   ],
   "importance": 18,
   "traits": {
    "open": 40,
    "consc": 50,
    "extra": 48,
    "agree": 38,
    "neuro": 62
   },
   "speech": "blunt",
   "wants_to_say": "He wants his wife and five-year-old son out of Kōtō ward and runs the Rainbow Bridge checkpoint.",
   "wants_to_hide": "He secretly sells crossings through his checkpoint to the Kurogane-kai to pay for a boat.",
   "hide_fid": 1002,
   "tags": [
    "greedy",
    "protective",
    "cowardly"
   ],
   "source": "JSDF"
  },
  {
   "id": "jin archer",
   "name": "Jin Archer",
   "aliases": [
    "Archer",
    "Mirror",
    "thằng Gương"
   ],
   "importance": 10,
   "traits": {
    "open": 65,
    "consc": 35,
    "extra": 58,
    "agree": 45,
    "neuro": 60
   },
   "speech": "playful",